[
  {
    "id": "tb-temoin-physique-chimie-001",
    "chapitre": "temoin-physique-chimie",
    "notions": [
      "n-temoin-physique-chimie-alpha"
    ],
    "capacites": [
      "bo-pc-temoin-01"
    ],
    "titre": "Exercice type bac d'essai n° 1 (documents)",
    "points": 6,
    "duree": 55,
    "calculatrice": true,
    "ordre": 10,
    "preambule": "Document d'essai 1 : texte.\n\nDocument d'essai 2 : tableau.\n\n| $t$ (s) | $0$ | $1$ |\n|---|---|---|\n| $x$ (m) | $0$ | $1{,}2$ |",
    "figure": {
      "type": "tree",
      "data": {
        "root": {
          "label": "Document d'essai 3",
          "children": [
            {
              "label": "Branche d'essai"
            }
          ]
        }
      }
    },
    "questions": [
      {
        "id": "q1",
        "label": "1.",
        "enonce": "Question d'essai 1. d'un exercice type bac.",
        "points": 2,
        "reponse": {
          "type": "numerique",
          "valeur": 1.2,
          "toleranceRelative": 0.05,
          "unite": "\\mathrm{m\\,s^{-1}}",
          "decimales": 1
        },
        "attenduCorrecteur": "Ce qui rapporte les points (essai).",
        "solution": "Solution d'essai rédigée comme au bac.",
        "indices": [
          "Indice d'essai n° 1."
        ]
      },
      {
        "id": "q2",
        "label": "2.",
        "enonce": "Question d'essai 2. d'un exercice type bac.",
        "points": 4,
        "attenduCorrecteur": "Ce qui rapporte les points (essai).",
        "solution": "Solution d'essai rédigée comme au bac.",
        "indices": [
          "Indice d'essai n° 1."
        ]
      }
    ]
  },
  {
    "id": "tb-temoin-physique-chimie-002",
    "chapitre": "temoin-physique-chimie",
    "notions": [
      "n-temoin-physique-chimie-alpha",
      "n-temoin-physique-chimie-beta"
    ],
    "capacites": [
      "bo-pc-temoin-01",
      "bo-pc-temoin-02"
    ],
    "titre": "Exercice type bac d'essai n° 2",
    "points": 4,
    "duree": 35,
    "calculatrice": true,
    "ordre": 20,
    "questions": [
      {
        "id": "q1",
        "label": "1.",
        "enonce": "Question d'essai 1. d'un exercice type bac.",
        "points": 4,
        "attenduCorrecteur": "Ce qui rapporte les points (essai).",
        "solution": "Solution d'essai rédigée comme au bac.",
        "indices": [
          "Indice d'essai n° 1."
        ]
      }
    ]
  },
  {
    "id": "tb-temoin-physique-chimie-003",
    "chapitre": "temoin-physique-chimie",
    "notions": [
      "n-temoin-physique-chimie-gamma"
    ],
    "capacites": [
      "bo-pc-temoin-03",
      "bo-pc-temoin-04"
    ],
    "titre": "Exercice type bac d'essai n° 3",
    "points": 10,
    "duree": 90,
    "calculatrice": true,
    "ordre": 30,
    "questions": [
      {
        "id": "q1",
        "label": "1.",
        "enonce": "Question d'essai 1. d'un exercice type bac.",
        "points": 5,
        "attenduCorrecteur": "Ce qui rapporte les points (essai).",
        "solution": "Solution d'essai rédigée comme au bac.",
        "indices": [
          "Indice d'essai n° 1."
        ]
      },
      {
        "id": "q2",
        "label": "2.",
        "enonce": "Question d'essai 2. d'un exercice type bac.",
        "points": 5,
        "attenduCorrecteur": "Ce qui rapporte les points (essai).",
        "solution": "Solution d'essai rédigée comme au bac.",
        "indices": [
          "Indice d'essai n° 1."
        ]
      }
    ]
  }
]
