[
  {
    "id": "tb-temoin-maths-001",
    "chapitre": "temoin-maths",
    "notions": [
      "n-temoin-maths-alpha",
      "n-temoin-maths-beta"
    ],
    "capacites": [
      "bo-m-temoin-01",
      "bo-m-temoin-03"
    ],
    "titre": "Exercice type bac d'essai n° 1",
    "points": 5,
    "duree": 45,
    "calculatrice": true,
    "ordre": 10,
    "preambule": "Préambule d'essai : données de l'exercice, puis « On admet que $u_n \\leqslant 2$ ».",
    "questions": [
      {
        "id": "q1",
        "label": "1.",
        "enonce": "Question d'essai 1. d'un exercice type bac.",
        "points": 2,
        "reponse": {
          "type": "numerique",
          "valeur": 3,
          "tolerance": 0
        },
        "indices": [
          "Indice d'essai."
        ],
        "revoir": "l-temoin-maths-003",
        "attenduCorrecteur": "Ce qui rapporte les points (essai).",
        "solution": "Solution d'essai rédigée comme au bac."
      },
      {
        "id": "q2",
        "label": "2.",
        "enonce": "Question d'essai 2. d'un exercice type bac.",
        "points": 3,
        "attenduCorrecteur": "Ce qui rapporte les points (essai).",
        "solution": "Solution d'essai rédigée comme au bac.",
        "indices": [
          "Indice d'essai n° 1."
        ]
      }
    ]
  },
  {
    "id": "tb-temoin-maths-002",
    "chapitre": "temoin-maths",
    "notions": [
      "n-temoin-maths-alpha"
    ],
    "capacites": [
      "bo-m-temoin-01",
      "bo-m-temoin-02"
    ],
    "titre": "Exercice type bac d'essai n° 2 (sous-questions)",
    "points": 5,
    "duree": 45,
    "calculatrice": false,
    "ordre": 20,
    "source": {
      "annale": "an-2024-temoin-j1",
      "adaptation": "données modifiées (essai)"
    },
    "questions": [
      {
        "id": "q1",
        "label": "1.",
        "enonce": "Question d'essai 1. d'un exercice type bac.",
        "points": 1,
        "attenduCorrecteur": "Ce qui rapporte les points (essai).",
        "solution": "Solution d'essai rédigée comme au bac.",
        "indices": [
          "Indice d'essai n° 1."
        ]
      },
      {
        "id": "q2",
        "label": "2.",
        "enonce": "Question d'essai 2. d'un exercice type bac.",
        "points": 4,
        "sousQuestions": [
          {
            "id": "q2a",
            "label": "a)",
            "enonce": "Sous-question d'essai a).",
            "points": 1.5,
            "attenduCorrecteur": "Ce qui rapporte les points (essai).",
            "solution": "Solution d'essai rédigée comme au bac.",
            "indices": [
              "Indice d'essai n° 1."
            ]
          },
          {
            "id": "q2b",
            "label": "b)",
            "enonce": "Sous-question d'essai b).",
            "points": 2.5,
            "reponse": {
              "type": "qcm",
              "choix": [
                "Choix d'essai 1",
                "Choix d'essai 2"
              ],
              "bonne": 0
            },
            "attenduCorrecteur": "Ce qui rapporte les points (essai).",
            "solution": "Solution d'essai rédigée comme au bac.",
            "indices": [
              "Indice d'essai n° 1."
            ]
          }
        ]
      }
    ]
  },
  {
    "id": "tb-temoin-maths-003",
    "chapitre": "temoin-maths",
    "notions": [
      "n-temoin-maths-gamma"
    ],
    "capacites": [
      "bo-m-temoin-05"
    ],
    "titre": "Exercice type bac d'essai n° 3",
    "points": 4,
    "duree": 35,
    "calculatrice": false,
    "ordre": 30,
    "source": {
      "url": "https://example.org/sujet-temoin.pdf",
      "adaptation": "questions réordonnées (essai)"
    },
    "code": {
      "langage": "python",
      "source": "u = 1\nfor k in range(5):\n    u = 2 * u + 1  # un ** Python reste du code, jamais du gras\nprint(u)"
    },
    "questions": [
      {
        "id": "q1",
        "label": "1.",
        "enonce": "Question d'essai 1. d'un exercice type bac.",
        "points": 2,
        "attenduCorrecteur": "Ce qui rapporte les points (essai).",
        "solution": "Solution d'essai rédigée comme au bac.",
        "indices": [
          "Indice d'essai n° 1."
        ]
      },
      {
        "id": "q2",
        "label": "2.",
        "enonce": "Question d'essai 2. d'un exercice type bac.",
        "points": 2,
        "attenduCorrecteur": "Ce qui rapporte les points (essai).",
        "solution": "Solution d'essai rédigée comme au bac.",
        "indices": [
          "Indice d'essai n° 1."
        ]
      }
    ]
  }
]
